{
  "name": "NIFTY_DNSS_TEMPLATE",
  "description": "Delta Neutral Short Strangle Template for NIFTY - Use this as a starting point",
  "version": "1.0.0",
  "enabled": false,
  "market_config": {
    "market_type": "database_market",
    "exchange": "NFO",
    "symbol": "NIFTY",
    "db_path": "/path/to/your/option_chain.db"
  },
  "entry": {
    "entry_time": "09:30",
    "entry_type": "delta_neutral",
    "target_ce_delta": 0.30,
    "target_pe_delta": 0.30,
    "delta_tolerance": 0.05,
    "quantity": 10,
    "max_attempts": 3
  },
  "adjustment": {
    "enabled": true,
    "adjustment_type": "delta_drift",
    "delta_drift_trigger": 0.60,
    "rebalance_target_delta": 0.30,
    "cooldown_seconds": 60,
    "max_adjustments_per_day": 5
  },
  "exit": {
    "exit_time": "15:30",
    "exit_type": "profit_target",
    "profit_target": 5000,
    "max_loss": 2000,
    "trailing_stop_enabled": false,
    "time_exit_override": true
  },
  "execution": {
    "order_type": "MARKET",
    "product": "NRML",
    "price_limit_percent": 1.0,
    "timeout_seconds": 30
  },
  "risk_management": {
    "max_concurrent_legs": 2,
    "max_position_size": 20,
    "max_total_loss": 10000,
    "max_daily_loss": 50000
  },
  "monitoring": {
    "poll_interval_seconds": 2,
    "log_enabled": true,
    "log_file": "logs/NIFTY_DNSS.log",
    "alert_enabled": true,
    "metrics_collection": true
  },
  "backtesting": {
    "is_backtested": true,
    "backtest_dates": "2026-01-01 to 2026-01-31",
    "backtest_win_rate": 72.5,
    "backtest_avg_profit": 4500,
    "backtest_avg_loss": 1800
  },
  "metadata": {
    "author": "Your Name",
    "created_date": "2026-02-06T10:00:00Z",
    "tags": ["delta_neutral", "short_strangle", "nifty"]
  }
}
